{
  "version": 1,
  "status": "generated",
  "definition": "frankfurt = AGS 06412000; kernraum = the 80 named Regionalverband FrankfurtRheinMain member municipalities; rheinmain = every municipality within the Metropolregion FrankfurtRheinMain's 18 Landkreise + kreisfreie Städte",
  "source": "scripts/generate_rings.py from Destatis GV100AD (region-frankfurt.de membership lists, retrieved 2026-08-13; see script header for the open kreisfreie-Städte count question)",
  "municipalities": [
    {
      "ags": "06411000",
      "name": "Darmstadt, Wissenschaftsstadt",
      "ring": "rheinmain"
    },
    {
      "ags": "06412000",
      "name": "Frankfurt am Main, Stadt",
      "ring": "frankfurt"
    },
    {
      "ags": "06413000",
      "name": "Offenbach am Main, Stadt",
      "ring": "kernraum"
    },
    {
      "ags": "06414000",
      "name": "Wiesbaden, Landeshauptstadt",
      "ring": "rheinmain"
    },
    {
      "ags": "06415000",
      "name": "Hanau, Brüder-Grimm-Stadt",
      "ring": "kernraum"
    },
    {
      "ags": "06431001",
      "name": "Abtsteinach",
      "ring": "rheinmain"
    },
    {
      "ags": "06431002",
      "name": "Bensheim, Stadt",
      "ring": "rheinmain"
    },
    {
      "ags": "06431003",
      "name": "Biblis",
      "ring": "rheinmain"
    },
    {
      "ags": "06431004",
      "name": "Birkenau",
      "ring": "rheinmain"
    },
    {
      "ags": "06431005",
      "name": "Bürstadt, Stadt",
      "ring": "rheinmain"
    },
    {
      "ags": "06431006",
      "name": "Einhausen",
      "ring": "rheinmain"
    },
    {
      "ags": "06431007",
      "name": "Fürth",
      "ring": "rheinmain"
    },
    {
      "ags": "06431008",
      "name": "Gorxheimertal",
      "ring": "rheinmain"
    },
    {
      "ags": "06431009",
      "name": "Grasellenbach",
      "ring": "rheinmain"
    },
    {
      "ags": "06431010",
      "name": "Groß-Rohrheim",
      "ring": "rheinmain"
    },
    {
      "ags": "06431011",
      "name": "Heppenheim (Bergstraße), Kreisstadt",
      "ring": "rheinmain"
    },
    {
      "ags": "06431012",
      "name": "Hirschhorn (Neckar), Stadt",
      "ring": "rheinmain"
    },
    {
      "ags": "06431013",
      "name": "Lampertheim, Stadt",
      "ring": "rheinmain"
    },
    {
      "ags": "06431014",
      "name": "Lautertal (Odenwald)",
      "ring": "rheinmain"
    },
    {
      "ags": "06431015",
      "name": "Lindenfels, Stadt",
      "ring": "rheinmain"
    },
    {
      "ags": "06431016",
      "name": "Lorsch, Karolingerstadt",
      "ring": "rheinmain"
    },
    {
      "ags": "06431017",
      "name": "Mörlenbach",
      "ring": "rheinmain"
    },
    {
      "ags": "06431018",
      "name": "Neckarsteinach, Stadt",
      "ring": "rheinmain"
    },
    {
      "ags": "06431019",
      "name": "Rimbach",
      "ring": "rheinmain"
    },
    {
      "ags": "06431020",
      "name": "Viernheim, Stadt",
      "ring": "rheinmain"
    },
    {
      "ags": "06431021",
      "name": "Wald-Michelbach",
      "ring": "rheinmain"
    },
    {
      "ags": "06431022",
      "name": "Zwingenberg, Stadt",
      "ring": "rheinmain"
    },
    {
      "ags": "06431200",
      "name": "Michelbuch, gemfr. Gebiet",
      "ring": "rheinmain"
    },
    {
      "ags": "06432001",
      "name": "Alsbach-Hähnlein",
      "ring": "rheinmain"
    },
    {
      "ags": "06432002",
      "name": "Babenhausen, Stadt",
      "ring": "rheinmain"
    },
    {
      "ags": "06432003",
      "name": "Bickenbach",
      "ring": "rheinmain"
    },
    {
      "ags": "06432004",
      "name": "Dieburg, Stadt",
      "ring": "rheinmain"
    },
    {
      "ags": "06432005",
      "name": "Eppertshausen",
      "ring": "rheinmain"
    },
    {
      "ags": "06432006",
      "name": "Erzhausen",
      "ring": "rheinmain"
    },
    {
      "ags": "06432007",
      "name": "Fischbachtal",
      "ring": "rheinmain"
    },
    {
      "ags": "06432008",
      "name": "Griesheim, Stadt",
      "ring": "rheinmain"
    },
    {
      "ags": "06432009",
      "name": "Groß-Bieberau, Stadt",
      "ring": "rheinmain"
    },
    {
      "ags": "06432010",
      "name": "Groß-Umstadt, Stadt",
      "ring": "rheinmain"
    },
    {
      "ags": "06432011",
      "name": "Groß-Zimmern",
      "ring": "rheinmain"
    },
    {
      "ags": "06432012",
      "name": "Messel",
      "ring": "rheinmain"
    },
    {
      "ags": "06432013",
      "name": "Modautal",
      "ring": "rheinmain"
    },
    {
      "ags": "06432014",
      "name": "Mühltal",
      "ring": "rheinmain"
    },
    {
      "ags": "06432015",
      "name": "Münster (Hessen)",
      "ring": "rheinmain"
    },
    {
      "ags": "06432016",
      "name": "Ober-Ramstadt, Stadt",
      "ring": "rheinmain"
    },
    {
      "ags": "06432017",
      "name": "Otzberg",
      "ring": "rheinmain"
    },
    {
      "ags": "06432018",
      "name": "Pfungstadt, Stadt",
      "ring": "rheinmain"
    },
    {
      "ags": "06432019",
      "name": "Reinheim, Stadt",
      "ring": "rheinmain"
    },
    {
      "ags": "06432020",
      "name": "Roßdorf",
      "ring": "rheinmain"
    },
    {
      "ags": "06432021",
      "name": "Schaafheim",
      "ring": "rheinmain"
    },
    {
      "ags": "06432022",
      "name": "Seeheim-Jugenheim",
      "ring": "rheinmain"
    },
    {
      "ags": "06432023",
      "name": "Weiterstadt, Stadt",
      "ring": "rheinmain"
    },
    {
      "ags": "06433001",
      "name": "Biebesheim am Rhein",
      "ring": "rheinmain"
    },
    {
      "ags": "06433002",
      "name": "Bischofsheim",
      "ring": "kernraum"
    },
    {
      "ags": "06433003",
      "name": "Büttelborn",
      "ring": "rheinmain"
    },
    {
      "ags": "06433004",
      "name": "Gernsheim, Schöfferstadt",
      "ring": "rheinmain"
    },
    {
      "ags": "06433005",
      "name": "Ginsheim-Gustavsburg, Stadt",
      "ring": "kernraum"
    },
    {
      "ags": "06433006",
      "name": "Groß-Gerau, Stadt",
      "ring": "kernraum"
    },
    {
      "ags": "06433007",
      "name": "Kelsterbach, Stadt",
      "ring": "kernraum"
    },
    {
      "ags": "06433008",
      "name": "Mörfelden-Walldorf, Stadt",
      "ring": "kernraum"
    },
    {
      "ags": "06433009",
      "name": "Nauheim",
      "ring": "kernraum"
    },
    {
      "ags": "06433010",
      "name": "Raunheim, Stadt",
      "ring": "kernraum"
    },
    {
      "ags": "06433011",
      "name": "Riedstadt, Büchnerstadt",
      "ring": "rheinmain"
    },
    {
      "ags": "06433012",
      "name": "Rüsselsheim am Main, Stadt",
      "ring": "kernraum"
    },
    {
      "ags": "06433013",
      "name": "Stockstadt am Rhein",
      "ring": "rheinmain"
    },
    {
      "ags": "06433014",
      "name": "Trebur",
      "ring": "rheinmain"
    },
    {
      "ags": "06434001",
      "name": "Bad Homburg v. d. Höhe, Stadt",
      "ring": "kernraum"
    },
    {
      "ags": "06434002",
      "name": "Friedrichsdorf, Philipp-Reis-Stadt",
      "ring": "kernraum"
    },
    {
      "ags": "06434003",
      "name": "Glashütten",
      "ring": "kernraum"
    },
    {
      "ags": "06434004",
      "name": "Grävenwiesbach",
      "ring": "kernraum"
    },
    {
      "ags": "06434005",
      "name": "Königstein im Taunus, Stadt",
      "ring": "kernraum"
    },
    {
      "ags": "06434006",
      "name": "Kronberg im Taunus, Stadt",
      "ring": "kernraum"
    },
    {
      "ags": "06434007",
      "name": "Neu-Anspach, Stadt",
      "ring": "kernraum"
    },
    {
      "ags": "06434008",
      "name": "Oberursel (Taunus), Stadt",
      "ring": "kernraum"
    },
    {
      "ags": "06434009",
      "name": "Schmitten im Taunus",
      "ring": "kernraum"
    },
    {
      "ags": "06434010",
      "name": "Steinbach (Taunus), Stadt",
      "ring": "kernraum"
    },
    {
      "ags": "06434011",
      "name": "Usingen, Stadt",
      "ring": "kernraum"
    },
    {
      "ags": "06434012",
      "name": "Wehrheim",
      "ring": "kernraum"
    },
    {
      "ags": "06434013",
      "name": "Weilrod",
      "ring": "kernraum"
    },
    {
      "ags": "06435001",
      "name": "Bad Orb, Stadt",
      "ring": "rheinmain"
    },
    {
      "ags": "06435002",
      "name": "Bad Soden-Salmünster, Stadt",
      "ring": "rheinmain"
    },
    {
      "ags": "06435003",
      "name": "Biebergemünd",
      "ring": "rheinmain"
    },
    {
      "ags": "06435004",
      "name": "Birstein",
      "ring": "rheinmain"
    },
    {
      "ags": "06435005",
      "name": "Brachttal",
      "ring": "rheinmain"
    },
    {
      "ags": "06435006",
      "name": "Bruchköbel, Stadt",
      "ring": "kernraum"
    },
    {
      "ags": "06435007",
      "name": "Erlensee, Stadt",
      "ring": "kernraum"
    },
    {
      "ags": "06435008",
      "name": "Flörsbachtal",
      "ring": "rheinmain"
    },
    {
      "ags": "06435009",
      "name": "Freigericht",
      "ring": "rheinmain"
    },
    {
      "ags": "06435010",
      "name": "Gelnhausen, Barbarossastadt, Kreisstadt",
      "ring": "rheinmain"
    },
    {
      "ags": "06435011",
      "name": "Großkrotzenburg",
      "ring": "kernraum"
    },
    {
      "ags": "06435012",
      "name": "Gründau",
      "ring": "rheinmain"
    },
    {
      "ags": "06435013",
      "name": "Hammersbach",
      "ring": "kernraum"
    },
    {
      "ags": "06435015",
      "name": "Hasselroth",
      "ring": "rheinmain"
    },
    {
      "ags": "06435016",
      "name": "Jossgrund",
      "ring": "rheinmain"
    },
    {
      "ags": "06435017",
      "name": "Langenselbold, Stadt",
      "ring": "kernraum"
    },
    {
      "ags": "06435018",
      "name": "Linsengericht",
      "ring": "rheinmain"
    },
    {
      "ags": "06435019",
      "name": "Maintal, Stadt",
      "ring": "kernraum"
    },
    {
      "ags": "06435020",
      "name": "Neuberg",
      "ring": "kernraum"
    },
    {